{
  "schema_version": "2.0",
  "work_id": "world-english-bible-classic",
  "title": "World English Bible Classic",
  "evidence": [
    "raw/ebible/eng-web/usfm/eng-web_usfm.zip",
    "raw/ebible/eng-web/usfm/acquisition-receipt.json",
    "raw/ebible/eng-web/usfx/eng-web_usfx.zip",
    "raw/ebible/eng-web/usfx/acquisition-receipt.json",
    "research/MANIFEST.md#L596"
  ],
  "textual_forms": []
}
