{"creators":[{"evidence":["raw/openmgh/bsb00000828/tei/bsb00000828.xml#bsb00000828_00318_34"],"name":"Manegold","role":"author"}],"evidence":["raw/openmgh/bsb00000828/tei/bsb00000828.xml#bsb00000828_00313_25","raw/openmgh/bsb00000828/tei/bsb00000828.xml#bsb00000828_00440_16","raw/openmgh/bsb00000828/bsb00000828.zip","raw/openmgh/bsb00000828/acquisition-receipt.json","research/MANIFEST.md#L590"],"schema_version":"2.0","textual_forms":[{"editions":[{"acquisition_ids":["manegold-to-gebhard-openmgh-acquired"],"containing_source":{"evidence":["raw/openmgh/bsb00000828/acquisition-receipt.json","raw/openmgh/bsb00000828/bsb00000828.zip","raw/openmgh/bsb00000828/tei/bsb00000828.xml#bsb00000828_00313_25","raw/openmgh/bsb00000828/tei/bsb00000828.xml#bsb00000828_00440_16"],"locator":"raw/openmgh/bsb00000828/tei/bsb00000828.xml#bsb00000828_00313_25; raw/openmgh/bsb00000828/tei/bsb00000828.xml#bsb00000828_00440_16","title":"Libelli de lite imperatorum et pontificum (MGH Ldl 1)"},"edition_id":"manegold-to-gebhard-openmgh-electronic","title":"Retained openMGH electronic witness in Libelli de lite imperatorum et pontificum (MGH Ldl 1)"}],"textual_form_id":"manegold-to-gebhard-openmgh-retained"}],"title":"Manegold, To Gebhard","work_id":"manegold-to-gebhard"}
