{
  "schema_version": "2.0",
  "work_id": "augustine-faith-and-creed",
  "title": "A Treatise on Faith and the Creed",
  "evidence": [
    "plans/2026-08-31-sample-first-library-verification/artifacts/2026-09-08-ticket37/library-status.json#/catalog_rows/48",
    "metadata/source-evidence/catalog/augustine-faith-and-creed.json"
  ],
  "textual_forms": []
}
