{
  "schema_version": "2.0",
  "work_id": "athanasius-on-the-incarnation",
  "title": "On the Incarnation of the Word",
  "textual_forms": [
    {
      "textual_form_id": "athanasius-on-the-incarnation-prose",
      "editions": [
        {
          "edition_id": "ccel-npnf204",
          "title": "On the Incarnation of the Word — CCEL NPNF2 volume 4 rendering",
          "language": "en",
          "category": "prose"
        }
      ]
    }
  ],
  "evidence": [
    "https://www.ccel.org/ccel/schaff/npnf204.xml#vii"
  ]
}
