{"evidence":["raw/clean-ready-acquisition-to-tei/master-1/07/newman-grammar-of-assent/pg34022-h.zip","plans/2026-08-31-sample-first-library-verification/artifacts/2026-09-08-ticket37/library-status.json#/acquisition_lanes/1","metadata/source-evidence/lanes/7436a51f071648f3a392527c62ad1f255ed13916a933d2abd4a68ef12e4b642b.json","plans/2026-09-22-source-preflight/direct-raw-four-extraction-receipt-20260926.json","sources/structured-text/newman-grammar-of-assent/acquisition-receipt.json","library/works/newman-grammar-of-assent/SOURCE_CREDIT.md","raw/clean-ready-acquisition-to-tei/master-1/07/newman-grammar-of-assent/extracted/pg34022-h/pg34022-images.html"],"schema_version":"2.0","textual_forms":[{"editions":[{"acquisition_ids":["newman-grammar-of-assent-gutenberg-acquired"],"edition_id":"newman-grammar-of-assent-gutenberg-electronic","language":"en","title":"Project Gutenberg eBook 34022, London 1874 witness"}],"language":"en","textual_form_id":"newman-grammar-of-assent-gutenberg-retained-en"}],"title":"An Essay in Aid of a Grammar of Assent","work_id":"newman-grammar-of-assent"}
